{"assertions":{"common_clean_engram_source_roster":true,"crebain_source_lineage_common":true,"distinct_closed_receipt_stores":true,"distinct_engram_runtime_source_closures":true,"distinct_receipt_and_evidence_identities":true,"engram_pack_source_lineage_common":true,"exact_6n_population_topology":true,"installed_package_lineage_common":true,"observed_build_stage_seal_install_lineage_common":true,"observed_build_stage_seal_pack_install_lineage_common":true,"one_session_per_run":true,"one_two_three_drone_roster":true,"tracked_inputs_exact":true},"authority":{"ncp_qualified":false,"physical_actuation":false,"plant_control":false,"scientific_authority":false,"simulator_only":true},"captures":[{"capture_sha256":"2dc14fb9e397d8d17f24f1b274e1afd6f7e22a06bb53707069298637044526ad","connection_count":96,"device_node_count":12,"drone_count":1,"engram_source_closure_sha256":"e14f7ec7e935d4de5a1c8dc565f1ef69ad9798c951dda9fa77a2216cc8c5148f","engram_source_roster_sha256":"83e5ecaf7968dfa57b0f052e199a1a252c88b4e59367f579cd29e4ae040c0e69","evidence_bundle_sha256":"bdfe0758b97e965ad6d05f145e035154f343ced8d2dc39dfa97ec78b8cfeceed","observed_build_receipt_exact_sha256":"28b7da3989982a18483d327809fb36c443d080898628f88ceb2ff173c91f73c4","path":"capture-1-drone.json","plan_exact_sha256":"79097c06394fb981a4a8fd6ea6e6a53036cdbc30e7649073e77ee8929b916780","population_count":6,"population_neuron_count":48,"receipt_sha256":"12bb842ad1cf8adc8592b9b6506ab6c050d93a405dd29627bd924c9ec801f23c","receipt_store_closure_sha256":"d0696d599874359478ede9c7313b05afc76dec608c17d1f0a2a76dd11c5c699e","receipt_store_id":"clrs_6e4de50bb0b6280bb20bb1b78698101fbfdce588d42088ec4b44f6e3bac7a99b","session_count":1},{"capture_sha256":"a93d91b4b97c3ab31995e365be3765e582857f137a97c36dbc2f11484c537e6a","connection_count":192,"device_node_count":24,"drone_count":2,"engram_source_closure_sha256":"208cacb432c2c68945b4e92eceb41c09ff406f114d133fde0a3bad91315ef51f","engram_source_roster_sha256":"83e5ecaf7968dfa57b0f052e199a1a252c88b4e59367f579cd29e4ae040c0e69","evidence_bundle_sha256":"9353c26155b3fdb18a3930a165a98cfe03d19e12d4f4058f35c4d7fff3c8c09c","observed_build_receipt_exact_sha256":"28b7da3989982a18483d327809fb36c443d080898628f88ceb2ff173c91f73c4","path":"capture-2-drones.json","plan_exact_sha256":"62fd541b63945bc32fb8ec2753841bf7c60536dd79a2e1436937adc176da46c9","population_count":12,"population_neuron_count":96,"receipt_sha256":"bdf39ff8281bc7a540a20708182d38a32a8ee42c8177d67ec1ec7e3b03eb485c","receipt_store_closure_sha256":"0a1989a88c3913ee5c90c42f374f186d4ab84280f1a942a758efb6e802c7a92c","receipt_store_id":"clrs_e0d5573ba2490d0853b92f99f2dfcc79b87f13d1ae550ef3832610f0310032e6","session_count":1},{"capture_sha256":"f739c6cbd3a18d1d193067db9762b680b48625d22df151797c96916863209b17","connection_count":288,"device_node_count":36,"drone_count":3,"engram_source_closure_sha256":"b15c740cbc59ee79c3bac2fe982a9b8ee20867e4f8fd7d4619b81b4b7623479a","engram_source_roster_sha256":"83e5ecaf7968dfa57b0f052e199a1a252c88b4e59367f579cd29e4ae040c0e69","evidence_bundle_sha256":"1be9ea9d34d8a952778fbc287aac12a5b709c1b63328cc850fe2a122092ff31c","observed_build_receipt_exact_sha256":"28b7da3989982a18483d327809fb36c443d080898628f88ceb2ff173c91f73c4","path":"capture-3-drones.json","plan_exact_sha256":"2cdce11a1c35147bbe8d755d67fd82a813132eb08bf21914ae871d2dd8fef357","population_count":18,"population_neuron_count":144,"receipt_sha256":"db2d6726d84c62747d51a4c2a505022776e9711148bc116397156c8f9aa5177e","receipt_store_closure_sha256":"589838626575ac5b5a0394bb0ce6834593e9a88fa2c93504b6b817ab90d5a28e","receipt_store_id":"clrs_ae21cb8356782ee3f9af48aebe9bdf22c87c29dc44fd91b3efcc06af87444ed1","session_count":1}],"crebain_source_repository":{"clean_at_capture":true,"commit":"9af59cb8fc1f89ff3772437ec3e30dbbec8ecfc6","object_format":"sha1","origin_main_at_capture":"9af59cb8fc1f89ff3772437ec3e30dbbec8ecfc6","repository":"https://github.com/sepahead/crebain.git","tree":"93c2376f452e8c5713c474e8e480500c4c63f31e"},"disclosure":"This index binds installed CREBAIN simulator and real NEST evidence. It is not physical authority or scientific validation.","engram":{"clean":true,"commit":"078c4fb1330682acde3ea3ea83610159f7c985f2","object_format":"sha1","origin_main":"078c4fb1330682acde3ea3ea83610159f7c985f2","repository":"https://github.com/sepahead/Paper2Brain.git","tree":"0674048d8062adae6044a09f8c40efa0935ec381"},"input_suite":{"exact_sha256":"96682b76c066e045c9ae9154704afc14e6e5b6133a66568dc83964c62d59e6a3","nest_config_exact_sha256":"98f8458d496eed4e57a28a537c746f2f0ea7d54521e8b525e15c7b66e26613b3","schema_version":"crebain.real-nest-operational-input-suite.v1","suite_definition_sha256":"b0c5710c737dd7b979de853e833342801f2767bf36769fe679c5e125e252007f"},"installed_package_proof_exact_sha256":"85d077c0a88482dfc6e3abf56fa17a4cc0b6d334b1acc88438c83589547d3d36","package":{"build_input_identity_sha256":"da326af2269c6069696f011d20c243368536c6c54cafb0e8ae30f4a72dce6301","build_source_roster_sha256":"bcb6da4cf37e38b348bf16ed3086859169c8dd47ef75b0cf2266597a48b14454","build_stage_seal_pack_install_lineage_verified":true,"bundle_receipt_exact_sha256":"cf1e8959287e738f05dff1b7fe5665f58150bd8757bd793939beeb0f3053b0de","configuration_canonical_sha256":"2557ed22e0668e86decea2f0404eaba198a48e9b6d8c7714dc2eac86733b032f","crebain_commit":"9af59cb8fc1f89ff3772437ec3e30dbbec8ecfc6","crebain_origin_main":"9af59cb8fc1f89ff3772437ec3e30dbbec8ecfc6","crebain_tree":"93c2376f452e8c5713c474e8e480500c4c63f31e","engram_commit":"078c4fb1330682acde3ea3ea83610159f7c985f2","engram_extension_tool_git_blob":"6ebea3f2ddcbb49e8649976b730563fdfab6d3a7","engram_extension_tool_sha256":"a965fe1a3fd81722bd27d127bcfad82bdc88fc2b3f7f080e96a9b10521fcb71f","engram_origin_main":"078c4fb1330682acde3ea3ea83610159f7c985f2","engram_pack_receipt_exact_sha256":"f538edd7edac1100a175440eaa9753f405dd0213b6e8f1100755e0b48754f89a","engram_pack_receipt_sha256":"b492d2a6493987dbd3dc6d5d12ac44b70d3d9afedaa0a50948f457301224ebec","engram_tree":"0674048d8062adae6044a09f8c40efa0935ec381","executable_architecture":"arm64","executable_format":"mach-o-64","executable_sha256":"a2add5310e2f6e6488682a4f7bff97732198fa05e06df8a5658e7c5229597746","generation_core_sha256":"9961557b25fc13ad452b5d92223bb8fb2848e47c1dbc6c968d1486a723546fb2","install_observation_exact_sha256":"fd5e9fc96ad5aceef001adbf09b2b32490df288af774680f27d1e5adb3fc93b3","installation_id":"inst_c2e3f82f2208cabe03f55aca6b4fdec4e1fc96489c592a03c4d4ef59a2a5f259","observed_build_receipt_exact_sha256":"28b7da3989982a18483d327809fb36c443d080898628f88ceb2ff173c91f73c4","observed_build_receipt_sha256":"baba55bfdc9387164170be5b77aa2daa01006f686f7572db13fbb5eb6250e536","operation_roster_sha256":"8e883db32c7cc01ab0913aa95d9f1730aa02c28b46709f130d1eb86a81c0503d","package_generation_id":"pkggen_395174b97212219466c4f7d8dd6e18c068ee7f372cbe38b914f12bc57ae28daa","package_sha256":"a43ed25a8efe82d4cc169e9983c67144be333c4dc2e7c77a888e7823e100718b","package_stage_receipt_exact_sha256":"3668346fb6ea03c06b448caaa40717d87e1e8ada458aa9629366ee607a6e4585","package_stage_receipt_sha256":"a9e4db9e815c20f67ce598935326218a4c8fcca58e200b83504baa66639481ad","receipt_sha256":"e5e89e90bf528b86bd9c7d86433202317137f1fc20332f22d8b66c0123aaf63b","seal_receipt_exact_sha256":"9e7badcab0a45693f95a8ae8a70021cfe540fdc7f8cdb9ff8ceac1754c1091d8","store_id":"extstore_8967bdc1d713855b771b425cccb1e6a8a720805f258f5421155ca3dc2eb1253c"},"profile":"installed-crebain-standard-v3-real-nest-3.9","schema_version":"crebain.real-nest-closed-loop-evidence-index.v2","tool_source_closure":{"files":[{"exact_sha256":"19a9deb4153232a391cc115283a693dfaad7406c8c4b81f4a830747090da6304","path":"scripts/managed_simulation_authoring_files.py","role":"atomic-authoring-io"},{"exact_sha256":"75a91fe2f4f71d8d0d7491505a0931ea6e9ea11926df0e76b2d36d984f9bdc02","path":"scripts/managed_simulation_build_provenance.py","role":"receipt-validator"},{"exact_sha256":"ca8b53bac6fd30b911ea341a05beca23404d965432596684cff4fc523f7f10f9","path":"scripts/run-managed-simulation-real-nest-proof.py","role":"capture-runner"},{"exact_sha256":"7e7f0ec9702488ee062ee8065b98c64cbf31499a4d2fcaf06b8ef830f57488af","path":"scripts/run-managed-simulation-real-nest-suite.py","role":"suite-runner"}],"roster_sha256":"95ccf312a10eb5b3f58357a88f6c3a10ffc9a4b92960b9fb73756ba02378cb15","schema_version":"crebain.real-nest-tool-source-closure.v1"}}
